"Position","Decimal","Name","Appearance"
"0x0374","884","GREEK NUMERAL SIGN","ʹ"
"0x0375","885","GREEK LOWER NUMERAL SIGN","͵"
"0x037A","890","GREEK YPOGEGRAMMENI","ͺ"
"0x037E","894","GREEK QUESTION MARK",";"
"0x0384","900","GREEK TONOS","΄"
"0x0385","901","GREEK DIALYTIKA TONOS","΅"
"0x0386","902","GREEK CAPITAL LETTER ALPHA WITH TONOS","Ά"
"0x0387","903","GREEK ANO TELEIA","·"
"0x0388","904","GREEK CAPITAL LETTER EPSILON WITH TONOS","Έ"
"0x0389","905","GREEK CAPITAL LETTER ETA WITH TONOS","Ή"
"0x038A","906","GREEK CAPITAL LETTER IOTA WITH TONOS","Ί"
"0x038C","908","GREEK CAPITAL LETTER OMICRON WITH TONOS","Ό"
"0x038E","910","GREEK CAPITAL LETTER UPSILON WITH TONOS","Ύ"
"0x038F","911","GREEK CAPITAL LETTER OMEGA WITH TONOS","Ώ"
"0x0390","912","GREEK SMALL LETTER IOTA WITH DIALYTIKA AND TONOS","ΐ"
"0x0391","913","GREEK CAPITAL LETTER ALPHA","Α"
"0x0392","914","GREEK CAPITAL LETTER BETA","Β"
"0x0393","915","GREEK CAPITAL LETTER GAMMA","Γ"
"0x0394","916","GREEK CAPITAL LETTER DELTA","Δ"
"0x0395","917","GREEK CAPITAL LETTER EPSILON","Ε"
"0x0396","918","GREEK CAPITAL LETTER ZETA","Ζ"
"0x0397","919","GREEK CAPITAL LETTER ETA","Η"
"0x0398","920","GREEK CAPITAL LETTER THETA","Θ"
"0x0399","921","GREEK CAPITAL LETTER IOTA","Ι"
"0x039A","922","GREEK CAPITAL LETTER KAPPA","Κ"
"0x039B","923","GREEK CAPITAL LETTER LAMDA","Λ"
"0x039C","924","GREEK CAPITAL LETTER MU","Μ"
"0x039D","925","GREEK CAPITAL LETTER NU","Ν"
"0x039E","926","GREEK CAPITAL LETTER XI","Ξ"
"0x039F","927","GREEK CAPITAL LETTER OMICRON","Ο"
"0x03A0","928","GREEK CAPITAL LETTER PI","Π"
"0x03A1","929","GREEK CAPITAL LETTER RHO","Ρ"
"0x03A3","931","GREEK CAPITAL LETTER SIGMA","Σ"
"0x03A4","932","GREEK CAPITAL LETTER TAU","Τ"
"0x03A5","933","GREEK CAPITAL LETTER UPSILON","Υ"
"0x03A6","934","GREEK CAPITAL LETTER PHI","Φ"
"0x03A7","935","GREEK CAPITAL LETTER CHI","Χ"
"0x03A8","936","GREEK CAPITAL LETTER PSI","Ψ"
"0x03A9","937","GREEK CAPITAL LETTER OMEGA","Ω"
"0x03AA","938","GREEK CAPITAL LETTER IOTA WITH DIALYTIKA","Ϊ"
"0x03AB","939","GREEK CAPITAL LETTER UPSILON WITH DIALYTIKA","Ϋ"
"0x03AC","940","GREEK SMALL LETTER ALPHA WITH TONOS","ά"
"0x03AD","941","GREEK SMALL LETTER EPSILON WITH TONOS","έ"
"0x03AE","942","GREEK SMALL LETTER ETA WITH TONOS","ή"
"0x03AF","943","GREEK SMALL LETTER IOTA WITH TONOS","ί"
"0x03B0","944","GREEK SMALL LETTER UPSILON WITH DIALYTIKA AND TONOS","ΰ"
"0x03B1","945","GREEK SMALL LETTER ALPHA","α"
"0x03B2","946","GREEK SMALL LETTER BETA","β"
"0x03B3","947","GREEK SMALL LETTER GAMMA","γ"
"0x03B4","948","GREEK SMALL LETTER DELTA","δ"
"0x03B5","949","GREEK SMALL LETTER EPSILON","ε"
"0x03B6","950","GREEK SMALL LETTER ZETA","ζ"
"0x03B7","951","GREEK SMALL LETTER ETA","η"
"0x03B8","952","GREEK SMALL LETTER THETA","θ"
"0x03B9","953","GREEK SMALL LETTER IOTA","ι"
"0x03BA","954","GREEK SMALL LETTER KAPPA","κ"
"0x03BB","955","GREEK SMALL LETTER LAMDA","λ"
"0x03BC","956","GREEK SMALL LETTER MU","μ"
"0x03BD","957","GREEK SMALL LETTER NU","ν"
"0x03BE","958","GREEK SMALL LETTER XI","ξ"
"0x03BF","959","GREEK SMALL LETTER OMICRON","ο"
"0x03C0","960","GREEK SMALL LETTER PI","π"
"0x03C1","961","GREEK SMALL LETTER RHO","ρ"
"0x03C2","962","GREEK SMALL LETTER FINAL SIGMA","ς"
"0x03C3","963","GREEK SMALL LETTER SIGMA","σ"
"0x03C4","964","GREEK SMALL LETTER TAU","τ"
"0x03C5","965","GREEK SMALL LETTER UPSILON","υ"
"0x03C6","966","GREEK SMALL LETTER PHI","φ"
"0x03C7","967","GREEK SMALL LETTER CHI","χ"
"0x03C8","968","GREEK SMALL LETTER PSI","ψ"
"0x03C9","969","GREEK SMALL LETTER OMEGA","ω"
"0x03CA","970","GREEK SMALL LETTER IOTA WITH DIALYTIKA","ϊ"
"0x03CB","971","GREEK SMALL LETTER UPSILON WITH DIALYTIKA","ϋ"
"0x03CC","972","GREEK SMALL LETTER OMICRON WITH TONOS","ό"
"0x03CD","973","GREEK SMALL LETTER UPSILON WITH TONOS","ύ"
"0x03CE","974","GREEK SMALL LETTER OMEGA WITH TONOS","ώ"
"0x03D0","976","GREEK BETA SYMBOL","ϐ"
"0x03D1","977","GREEK THETA SYMBOL","ϑ"
"0x03D2","978","GREEK UPSILON WITH HOOK SYMBOL","ϒ"
"0x03D3","979","GREEK UPSILON WITH ACUTE AND HOOK SYMBOL","ϓ"
"0x03D4","980","GREEK UPSILON WITH DIAERESIS AND HOOK SYMBOL","ϔ"
"0x03D5","981","GREEK PHI SYMBOL","ϕ"
"0x03D6","982","GREEK PI SYMBOL","ϖ"
"0x03D7","983","GREEK KAI SYMBOL","ϗ"
"0x03DA","986","GREEK LETTER STIGMA","Ϛ"
"0x03DB","987","GREEK SMALL LETTER STIGMA","ϛ"
"0x03DC","988","GREEK LETTER DIGAMMA","Ϝ"
"0x03DD","989","GREEK SMALL LETTER DIGAMMA","ϝ"
"0x03DE","990","GREEK LETTER KOPPA","Ϟ"
"0x03DF","991","GREEK SMALL LETTER KOPPA","ϟ"
"0x03E0","992","GREEK LETTER SAMPI","Ϡ"
"0x03E1","993","GREEK SMALL LETTER SAMPI","ϡ"
"0x03E2","994","COPTIC CAPITAL LETTER SHEI","Ϣ"
"0x03E3","995","COPTIC SMALL LETTER SHEI","ϣ"
"0x03E4","996","COPTIC CAPITAL LETTER FEI","Ϥ"
"0x03E5","997","COPTIC SMALL LETTER FEI","ϥ"
"0x03E6","998","COPTIC CAPITAL LETTER KHEI","Ϧ"
"0x03E7","999","COPTIC SMALL LETTER KHEI","ϧ"
"0x03E8","1000","COPTIC CAPITAL LETTER HORI","Ϩ"
"0x03E9","1001","COPTIC SMALL LETTER HORI","ϩ"
"0x03EA","1002","COPTIC CAPITAL LETTER GANGIA","Ϫ"
"0x03EB","1003","COPTIC SMALL LETTER GANGIA","ϫ"
"0x03EC","1004","COPTIC CAPITAL LETTER SHIMA","Ϭ"
"0x03ED","1005","COPTIC SMALL LETTER SHIMA","ϭ"
"0x03EE","1006","COPTIC CAPITAL LETTER DEI","Ϯ"
"0x03EF","1007","COPTIC SMALL LETTER DEI","ϯ"
"0x03F0","1008","GREEK KAPPA SYMBOL","ϰ"
"0x03F1","1009","GREEK RHO SYMBOL","ϱ"
"0x03F2","1010","GREEK LUNATE SIGMA SYMBOL","ϲ"
"0x03F3","1011","GREEK LETTER YOT","ϳ"
